{
  "$schema": "https://json-schema.org/draft/2020-12/schema",
  "title": "Source-backed Context Record",
  "description": "An explicitly reviewed reference record, never an instruction or proof of semantic correctness. Runtime additionally checks byte limits, path containment, symlinks, source hashes, timestamp ordering, age, expiry, and conflicts.",
  "type": "object",
  "additionalProperties": false,
  "required": ["schema_version", "id", "key", "kind", "scope", "text", "status", "recorded_at", "verified_at", "expires_at", "verified_by", "sources"],
  "properties": {
    "schema_version": { "const": "1.0" },
    "id": { "$ref": "#/$defs/identifier" },
    "key": {
      "$ref": "#/$defs/identifier",
      "description": "Stable semantic subject shared by competing records; equal keys with different text or kind in overlapping scopes are quarantined."
    },
    "kind": { "enum": ["fact", "decision", "constraint", "lesson"] },
    "scope": {
      "type": "array",
      "minItems": 1,
      "maxItems": 16,
      "uniqueItems": true,
      "items": { "anyOf": [{ "const": "." }, { "$ref": "#/$defs/relativePath" }] },
      "description": "Repository-relative file or directory scopes; a single dot means the whole project. No glob syntax."
    },
    "text": { "type": "string", "minLength": 1, "maxLength": 4096, "description": "Concise reviewed fact or decision. Runtime limits UTF-8 encoding to 4096 bytes. Exclude secrets and transcripts." },
    "status": { "enum": ["active", "superseded", "retracted"] },
    "recorded_at": { "$ref": "#/$defs/timestamp" },
    "verified_at": { "$ref": "#/$defs/timestamp" },
    "expires_at": { "$ref": "#/$defs/timestamp" },
    "verified_by": { "type": "string", "minLength": 1, "maxLength": 120, "description": "Reviewing person or evidence-producing process; a recorded attribution, not authenticated identity. Runtime limits UTF-8 encoding to 120 bytes." },
    "sources": {
      "type": "array",
      "minItems": 1,
      "maxItems": 8,
      "items": {
        "type": "object",
        "additionalProperties": false,
        "required": ["path", "sha256"],
        "properties": {
          "path": { "$ref": "#/$defs/relativePath" },
          "sha256": { "type": "string", "pattern": "^[a-f0-9]{64}$", "description": "Hash of the complete current file bytes, computed when its claim was checked." }
        }
      }
    }
  },
  "$defs": {
    "identifier": { "type": "string", "pattern": "^[a-z0-9][a-z0-9._-]{0,95}$" },
    "relativePath": { "type": "string", "minLength": 1, "maxLength": 240, "pattern": "^(?!/)(?!.*[\\\\:\\u0000-\\u001f\\u007f])(?!.*(?:^|/)\\.{1,2}(?:/|$))[^/]+(?:/[^/]+)*$" },
    "timestamp": { "type": "string", "format": "date-time", "pattern": "^\\d{4}-\\d{2}-\\d{2}T\\d{2}:\\d{2}:\\d{2}(?:\\.\\d{3})?Z$" }
  }
}
